{"alias_allowlist":{"entity_count":11,"path":"data/registry/approved-aliases.json","sha256":"117afaa544385dfcd54c0aee0bc15ec4f001b1f188d20b16c90bb4f35e98bc89"},"counts":{"by_kind":{"event":23,"institute":31,"person":267},"historical_relations":0,"total":321},"generated_by":"pipeline.registry:v3","legacy_ref":"e2abd60b8df5a974a53720f873b3d270856e101b","legacy_ref_commit":"e2abd60b8df5a974a53720f873b3d270856e101b","provenance_manifest_sha256":"bf5d045e178093b6e4817f388a60b421f22ffddff8f72b155b86b0dd67f4059d","reconciliation":{"composite_records_held_for_adjudication":7,"fundamental_people_joined":4,"legacy_id_mappings":{"institute:feza_gursey_institute":"institute:feza_gursey_enstitusu","person:gunduz_ikeda":"person:masatoshi_gunduz_ikeda"},"prior_claude_derived_records":16,"rules":["The 267-person merged master is keyed by canonical_node_id.","The four fundamental rows join the master; presentation roles are configured separately.","Only canonical names, allowlisted aliases, and coarse entity kinds migrate.","No legacy edge, evidence, role, discipline, affiliation, date, or biography migrates."]},"registry_sha256":"d57cefc593031585e16dc7aca7ca85df8b132bf55394a87f8153788d2c1aeabd","registry_version":"legacy-node-registry-v1","source_files":[{"path":"e2abd60b8df5a974a53720f873b3d270856e101b:data/input/fundamental_persons.csv","row_count":4,"sha256":"cb8b89e0f4240e06ffdd9a783b1cbbb6d1c0c571f97a824752e7992c879fb1d6"},{"path":"e2abd60b8df5a974a53720f873b3d270856e101b:data/input/base_persons.csv","row_count":267,"sha256":"8bbc74bcfd7da9a04a8ef0f27db05a2b09a1958a7959b4955747c0ef248b1610"},{"path":"e2abd60b8df5a974a53720f873b3d270856e101b:data/input/events.csv","row_count":23,"sha256":"fdf74f02e515c03ed252386130af9123c6b7177b984a4f03320576c24eaed7b1"},{"path":"e2abd60b8df5a974a53720f873b3d270856e101b:data/input/institutes.csv","row_count":31,"sha256":"dba0591f85419695d3c8ec2d8b816d384a46a31574abfdacdce3dd3dabef3f0e"}]}
